{
  "schemaVersion": 1,
  "exam": "CCNAAUTO-200-901",
  "blueprintVersion": "v1.1",
  "sourcePdf": "200-901-CCNAAUTO_v.1.1.pdf",
  "bankSize": 100,
  "verificationPolicy": {
    "allowedHostSuffixes": ["cisco.com", "developer.cisco.com", "learningnetwork.cisco.com"],
    "disallowedSourceTypes": [
      "exam-dump",
      "forum",
      "reddit",
      "discord",
      "competitor-practice-site"
    ]
  },
  "domains": [
    {
      "id": "1.0",
      "name": "Software Development and Design",
      "weightPercent": 15,
      "questionsPerBank": 15
    },
    {
      "id": "2.0",
      "name": "Understanding and Using APIs",
      "weightPercent": 20,
      "questionsPerBank": 20
    },
    {
      "id": "3.0",
      "name": "Cisco Platforms and Development",
      "weightPercent": 15,
      "questionsPerBank": 15
    },
    {
      "id": "4.0",
      "name": "Application Deployment and Security",
      "weightPercent": 15,
      "questionsPerBank": 15
    },
    {
      "id": "5.0",
      "name": "Infrastructure and Automation",
      "weightPercent": 20,
      "questionsPerBank": 20
    },
    {
      "id": "6.0",
      "name": "Network Fundamentals",
      "weightPercent": 15,
      "questionsPerBank": 15
    }
  ]
}
