{
  "schemaVersion": 1,
  "exam": "SY0-701",
  "blueprintVersion": "701",
  "sourcePdf": "CompTIA-Security-Plus-SY0-701-Exam-Objectives.pdf",
  "bankSize": 100,
  "verificationPolicy": {
    "allowedHostSuffixes": [
      "comptia.org",
      "learn.comptia.org",
      "nist.gov",
      "csrc.nist.gov",
      "ietf.org",
      "rfc-editor.org",
      "owasp.org"
    ],
    "disallowedSourceTypes": [
      "exam-dump",
      "forum",
      "reddit",
      "discord",
      "competitor-practice-site"
    ]
  },
  "domains": [
    {
      "id": "1.0",
      "name": "General Security Concepts",
      "weightPercent": 12,
      "questionsPerBank": 12
    },
    {
      "id": "2.0",
      "name": "Threats, Vulnerabilities, and Mitigations",
      "weightPercent": 22,
      "questionsPerBank": 22
    },
    {
      "id": "3.0",
      "name": "Security Architecture",
      "weightPercent": 18,
      "questionsPerBank": 18
    },
    {
      "id": "4.0",
      "name": "Security Operations",
      "weightPercent": 28,
      "questionsPerBank": 28
    },
    {
      "id": "5.0",
      "name": "Security Program Management and Oversight",
      "weightPercent": 20,
      "questionsPerBank": 20
    }
  ]
}
